{
  "schema_version": "0.1",
  "skill_id": "realtime-api-integration",
  "source_revision": "fb595c02abb77dc213b1e0b1ae41aea46932aa39",
  "artifact_sha256": "ce593c123c9bede73f35f98dbe9e4ebbbc7a7de66ae31457dd3bdbc996031610",
  "security_gate": {
    "version": "v2",
    "result": "pass",
    "blocking_findings": 0
  },
  "reads": {
    "state": "declared-plus-static-scan",
    "declared": "writes server.mjs, package.json, .env.example and transport-plan.json",
    "observed": "Filesystem activity signal observed; review report for context."
  },
  "writes": {
    "state": "declared-plus-static-scan",
    "declared": "writes server.mjs, package.json, .env.example and transport-plan.json",
    "observed": "Filesystem write reference observed."
  },
  "sends_externally": {
    "state": "declared-plus-static-scan",
    "declared": "none during scaffolding; generated server uses OpenAI Realtime when later run",
    "observed": "No active network operation reference observed."
  },
  "executes": {
    "state": "declared-plus-static-scan",
    "declared": "none in the scaffolder",
    "observed": "No process execution reference observed."
  },
  "secrets": {
    "state": "declared-plus-static-scan",
    "declared": "does not read secrets; generated server expects OPENAI_API_KEY",
    "observed": "Secret/credential terminology observed."
  },
  "destructive_potential": {
    "state": "declared-plus-static-scan",
    "declared": "writes named files in the selected target",
    "observed": "No destructive operation reference observed."
  },
  "human_confirmation": {
    "state": "unknown",
    "declared": "Not yet modeled as a normalized permission dimension in 0.7-B.",
    "observed": "Static scanning cannot prove runtime confirmation behavior."
  },
  "unknowns": [
    "Static analysis cannot prove absence of malicious behavior.",
    "Runtime behavior may differ across execution surfaces or external dependencies.",
    "Human-confirmation semantics are not yet normalized."
  ],
  "evidence_refs": [
    "trust/passports/realtime-api-integration.json",
    "trust/security-reports/realtime-api-integration.json"
  ]
}
