{
  "schema_version": "0.1",
  "skill_id": "cs-navigator",
  "source_revision": "ae180a7ad3ffc34191e7ff9e683ed27b9709fb93",
  "artifact_sha256": "cbf510a44c2051cde06d8d4b02ae7f3d4e3c5c8db33a3f22840b0873be4aae09",
  "security_gate": {
    "version": "v2",
    "result": "pass",
    "blocking_findings": 0
  },
  "reads": {
    "state": "declared-plus-static-scan",
    "declared": "none required by the chat-native workflow; it reads only its bundled reference snapshot through the skill runtime",
    "observed": "No additional read signal inferred by Security Gate v2."
  },
  "writes": {
    "state": "declared-plus-static-scan",
    "declared": "none required by the chat-native workflow; it reads only its bundled reference snapshot through the skill runtime",
    "observed": "No filesystem write reference observed."
  },
  "sends_externally": {
    "state": "declared-plus-static-scan",
    "declared": "none required",
    "observed": "No active network operation reference observed."
  },
  "executes": {
    "state": "declared-plus-static-scan",
    "declared": "none required",
    "observed": "No process execution reference observed."
  },
  "secrets": {
    "state": "declared-plus-static-scan",
    "declared": "none required",
    "observed": "Secret/credential terminology observed."
  },
  "destructive_potential": {
    "state": "declared-plus-static-scan",
    "declared": "none required",
    "observed": "Destructive operation reference observed."
  },
  "human_confirmation": {
    "state": "unknown",
    "declared": "Not yet modeled as a normalized permission dimension in 0.7-B.",
    "observed": "Static scanning cannot prove runtime confirmation behavior."
  },
  "unknowns": [
    "Static analysis cannot prove absence of malicious behavior.",
    "Runtime behavior may differ across execution surfaces or external dependencies.",
    "Human-confirmation semantics are not yet normalized."
  ],
  "evidence_refs": [
    "trust/passports/cs-navigator.json",
    "trust/security-reports/cs-navigator.json"
  ]
}
