{
  "schema_version": "0.1",
  "skill_id": "codex-pr-reviewer",
  "source_revision": "ab8cb8cd7e2c7ca5c9bb73800552b25e361a0098",
  "artifact_sha256": "13006a226a157908476397bfd6d0f5af755fcbb748ea1081fc223c290263e825",
  "security_gate": {
    "version": "v2",
    "result": "pass",
    "blocking_findings": 0
  },
  "reads": {
    "state": "declared-plus-static-scan",
    "declared": "reads a JSON rules file and writes one Markdown prompt",
    "observed": "Filesystem activity signal observed; review report for context."
  },
  "writes": {
    "state": "declared-plus-static-scan",
    "declared": "reads a JSON rules file and writes one Markdown prompt",
    "observed": "Filesystem write reference observed."
  },
  "sends_externally": {
    "state": "declared-plus-static-scan",
    "declared": "none",
    "observed": "No active network operation reference observed."
  },
  "executes": {
    "state": "declared-plus-static-scan",
    "declared": "none",
    "observed": "No process execution reference observed."
  },
  "secrets": {
    "state": "declared-plus-static-scan",
    "declared": "none required",
    "observed": "No secret/credential reference observed."
  },
  "destructive_potential": {
    "state": "declared-plus-static-scan",
    "declared": "overwrites the configured output prompt",
    "observed": "No destructive operation reference observed."
  },
  "human_confirmation": {
    "state": "unknown",
    "declared": "Not yet modeled as a normalized permission dimension in 0.7-B.",
    "observed": "Static scanning cannot prove runtime confirmation behavior."
  },
  "unknowns": [
    "Static analysis cannot prove absence of malicious behavior.",
    "Runtime behavior may differ across execution surfaces or external dependencies.",
    "Human-confirmation semantics are not yet normalized."
  ],
  "evidence_refs": [
    "trust/passports/codex-pr-reviewer.json",
    "trust/security-reports/codex-pr-reviewer.json"
  ]
}
