{
  "schema_version": "0.1",
  "skill_id": "regenerative-listening-loop",
  "source_revision": "b75e2f282372336d5d839782a5dd8a392c7519dc",
  "artifact_sha256": "238882d2f228cf5c085cfba9ae504540b783f48d27e855e70f9daaab7141c388",
  "security_gate": {
    "version": "v2",
    "result": "pass",
    "blocking_findings": 0
  },
  "reads": {
    "state": "declared-plus-static-scan",
    "declared": "none required by the packaged instruction skill",
    "observed": "No additional read signal inferred by Security Gate v2."
  },
  "writes": {
    "state": "declared-plus-static-scan",
    "declared": "none required by the packaged instruction skill",
    "observed": "No filesystem write reference observed."
  },
  "sends_externally": {
    "state": "declared-plus-static-scan",
    "declared": "none required",
    "observed": "No active network operation reference observed."
  },
  "executes": {
    "state": "declared-plus-static-scan",
    "declared": "none required",
    "observed": "No process execution reference observed."
  },
  "secrets": {
    "state": "declared-plus-static-scan",
    "declared": "none required",
    "observed": "No secret/credential reference observed."
  },
  "destructive_potential": {
    "state": "declared-plus-static-scan",
    "declared": "none required",
    "observed": "No destructive operation reference observed."
  },
  "human_confirmation": {
    "state": "unknown",
    "declared": "Not yet modeled as a normalized permission dimension in 0.7-B.",
    "observed": "Static scanning cannot prove runtime confirmation behavior."
  },
  "unknowns": [
    "Static analysis cannot prove absence of malicious behavior.",
    "Runtime behavior may differ across execution surfaces or external dependencies.",
    "Human-confirmation semantics are not yet normalized."
  ],
  "evidence_refs": [
    "trust/passports/regenerative-listening-loop.json",
    "trust/security-reports/regenerative-listening-loop.json"
  ]
}
