{
  "schema_version": "0.1",
  "skill_id": "openai-agents-sdk-builder",
  "source_revision": "6ef65595ddb23164e602cc8cec77c3f666136f24",
  "artifact_sha256": "6f89c0ee7fca10165214abf08b71c92c7974306724625d53f14aea5dfeb3d515",
  "security_gate": {
    "version": "v2",
    "result": "pass",
    "blocking_findings": 0
  },
  "reads": {
    "state": "declared-plus-static-scan",
    "declared": "writes scaffold files in a user-selected target",
    "observed": "Filesystem activity signal observed; review report for context."
  },
  "writes": {
    "state": "declared-plus-static-scan",
    "declared": "writes scaffold files in a user-selected target",
    "observed": "Filesystem write reference observed."
  },
  "sends_externally": {
    "state": "declared-plus-static-scan",
    "declared": "none during scaffolding; generated app uses OpenAI API when later run",
    "observed": "No active network operation reference observed."
  },
  "executes": {
    "state": "declared-plus-static-scan",
    "declared": "none in the scaffolder",
    "observed": "No process execution reference observed."
  },
  "secrets": {
    "state": "declared-plus-static-scan",
    "declared": "does not read secrets; generated app expects OPENAI_API_KEY",
    "observed": "Secret/credential terminology observed."
  },
  "destructive_potential": {
    "state": "declared-plus-static-scan",
    "declared": "--force can overwrite generated files in the selected target",
    "observed": "Destructive operation reference observed."
  },
  "human_confirmation": {
    "state": "unknown",
    "declared": "Not yet modeled as a normalized permission dimension in 0.7-B.",
    "observed": "Static scanning cannot prove runtime confirmation behavior."
  },
  "unknowns": [
    "Static analysis cannot prove absence of malicious behavior.",
    "Runtime behavior may differ across execution surfaces or external dependencies.",
    "Human-confirmation semantics are not yet normalized."
  ],
  "evidence_refs": [
    "trust/passports/openai-agents-sdk-builder.json",
    "trust/security-reports/openai-agents-sdk-builder.json"
  ]
}
